<?xml version="1.0" encoding="UTF-8"?>

<!--
  XML DTD for the Aspectran Configuration File, Version 9.0

  Copyright 2018-present The Aspectran Project

  This DTD module is identified by the PUBLIC and SYSTEM identifiers:

  PUBLIC "-//ASPECTRAN//DTD Aspectran 9.0//EN"
  SYSTEM "https://aspectran.com/dtd/aspectran-9.dtd">

  XML documents that conform to this DTD should declare the following doctype:

  <!DOCTYPE aspectran PUBLIC "-//ASPECTRAN//DTD Aspectran 9.0//EN"
          "https://aspectran.com/dtd/aspectran-9.dtd">
-->

<!ELEMENT aspectran (
  description*,
  settings?,
  (typeAliases | environment | aspect | bean | schedule | translet | template | append)*
)>

<!ELEMENT description (#PCDATA)>
<!ATTLIST description
  profile CDATA #IMPLIED
  style   (apon | compact | compressed) #IMPLIED
>

<!ELEMENT settings (setting+)>
<!ELEMENT setting EMPTY>
<!ATTLIST setting
  name    CDATA #REQUIRED
  value   CDATA #REQUIRED
>

<!ELEMENT typeAliases (typeAlias+)>
<!ELEMENT typeAlias EMPTY>
<!ATTLIST typeAlias
  alias   CDATA #REQUIRED
  type    CDATA #REQUIRED
>

<!ELEMENT environment (description*, property*, properties*)>
<!ATTLIST environment
  profile CDATA #IMPLIED
>

<!ELEMENT aspect (description*, joinpoint?, settings?, advice?, exception?)>
<!ATTLIST aspect
  id       ID #IMPLIED
  order    CDATA #IMPLIED
  isolated (true | false) #IMPLIED
  disabled (true | false) #IMPLIED
>

<!ELEMENT joinpoint (#PCDATA)>
<!ATTLIST joinpoint
  target  (activity | method) #IMPLIED
>

<!ELEMENT advice (before?, after?, finally?)>
<!ATTLIST advice
  bean    CDATA #IMPLIED
>

<!ELEMENT before  (headers | echo | (action | invoke))>
<!ELEMENT after   (headers | echo | (action | invoke))>
<!ELEMENT finally (thrown?, (headers | echo | (action | invoke)))>

<!ELEMENT exception (description*, thrown+)>

<!ELEMENT thrown ((headers | echo | (action | invoke)?)?, (transform | dispatch | redirect)*)>
<!ATTLIST thrown
  type    CDATA #IMPLIED
>

<!ELEMENT bean (description*, filter?, argument*, arguments*, property*, properties*)>
<!ATTLIST bean
  id            CDATA #IMPLIED
  class         CDATA #IMPLIED
  scan          CDATA #IMPLIED
  mask          CDATA #IMPLIED
  factoryBean   CDATA #IMPLIED
  factoryMethod CDATA #IMPLIED
  initMethod    CDATA #IMPLIED
  destroyMethod CDATA #IMPLIED
  dependsOn     CDATA #IMPLIED
  scope         (singleton | prototype | request | session) #IMPLIED
  singleton     (true | false) #IMPLIED
  lazyInit      (true | false) #IMPLIED
  lazyDestroy   (true | false) #IMPLIED
  important     (true | false) #IMPLIED
>

<!ELEMENT filter (#PCDATA)>
<!ATTLIST filter
  class   CDATA #IMPLIED
>

<!ELEMENT schedule (description*, scheduler, job*)>
<!ATTLIST schedule
  id       ID #IMPLIED
  isolated (true | false) #IMPLIED
  disabled (true | false) #IMPLIED
>

<!ELEMENT scheduler (trigger)>
<!ATTLIST scheduler
  bean    CDATA #IMPLIED
>

<!ELEMENT trigger (#PCDATA)>
<!ATTLIST trigger
  type    CDATA #IMPLIED
>

<!ELEMENT job EMPTY>
<!ATTLIST job
  translet CDATA #REQUIRED
  isolated (true | false) #IMPLIED
  disabled (true | false) #IMPLIED
>

<!ELEMENT translet (
  description*,
  (request? | (parameter*, parameters*, attribute*, attributes*)),
  ((contents | content)? | (choose | headers | echo | action | include)*),
  (response* | (transform | dispatch | forward | redirect)?),
  exception?
)>
<!ATTLIST translet
  name    CDATA #REQUIRED
  scan    CDATA #IMPLIED
  mask    CDATA #IMPLIED
  method  CDATA #IMPLIED
  async   (true | false) #IMPLIED
  timeout CDATA #IMPLIED
>

<!ELEMENT request (parameter*, attribute*, parameters*, attributes*)>
<!ATTLIST request
  method   CDATA #IMPLIED
  encoding CDATA #IMPLIED
>

<!ELEMENT contents (content*)>
<!ATTLIST contents
  name    CDATA #IMPLIED
>

<!ELEMENT content (choose | headers | echo | action | include)*>
<!ATTLIST content
  name    CDATA #IMPLIED
>

<!ELEMENT choose (when*, otherwise?)>

<!ELEMENT when ((headers | echo | action | include | choose)*, (transform | dispatch | forward | redirect)?)>
<!ATTLIST when
  test    CDATA #IMPLIED
>

<!ELEMENT otherwise ((headers | echo | action | include | choose)*, (transform | dispatch | forward | redirect)?)>

<!ELEMENT headers (item*)>
<!ATTLIST headers
  id      CDATA #IMPLIED
  hidden  (true | false) #IMPLIED
>

<!ELEMENT echo (item*)>
<!ATTLIST echo
  id      CDATA #IMPLIED
  hidden  (true | false) #IMPLIED
>

<!ELEMENT action (argument*, arguments*, property*, properties*)>
<!ATTLIST action
  id      CDATA #IMPLIED
  bean    CDATA #REQUIRED
  method  CDATA #REQUIRED
  hidden  (true | false) #IMPLIED
>

<!ELEMENT invoke (argument*, arguments*, property*, properties*)>
<!ATTLIST invoke
  method  CDATA #REQUIRED
  hidden  (true | false) #IMPLIED
>

<!ELEMENT include (parameter*, parameters*, attribute*, attributes*)>
<!ATTLIST include
  id       CDATA #IMPLIED
  translet CDATA #REQUIRED
  method   CDATA #IMPLIED
  hidden   (true | false) #IMPLIED
>

<!ELEMENT response ((choose | headers | echo | action | include)*, (transform | dispatch | forward | redirect)?)>
<!ATTLIST response
  name     CDATA #IMPLIED
  encoding CDATA #IMPLIED
>

<!ELEMENT transform (template?)>
<!ATTLIST transform
  format      CDATA #IMPLIED
  contentType CDATA #IMPLIED
  encoding    CDATA #IMPLIED
  default     (true | false) #IMPLIED
  pretty      (true | false) #IMPLIED
>

<!ELEMENT dispatch EMPTY>
<!ATTLIST dispatch
  name        CDATA #REQUIRED
  dispatcher  CDATA #IMPLIED
  contentType CDATA #IMPLIED
  encoding    CDATA #IMPLIED
  default     (true | false) #IMPLIED
>

<!ELEMENT forward (attribute*, attributes*)>
<!ATTLIST forward
  contentType CDATA #IMPLIED
  translet    CDATA #REQUIRED
  method      CDATA #IMPLIED
  default     (true | false) #IMPLIED
>

<!ELEMENT redirect (parameter*, parameters*)>
<!ATTLIST redirect
  contentType            CDATA #IMPLIED
  path                   CDATA #REQUIRED
  encoding               CDATA #IMPLIED
  excludeNullParameters  (true | false) #IMPLIED
  excludeEmptyParameters (true | false) #IMPLIED
  default                (true | false) #IMPLIED
>

<!ELEMENT parameters (item*)>
<!ATTLIST parameters
  profile CDATA #IMPLIED
>

<!ELEMENT attributes (item*)>
<!ATTLIST attributes
  profile CDATA #IMPLIED
>

<!ELEMENT arguments (item*)>
<!ATTLIST arguments
  profile CDATA #IMPLIED
>

<!ELEMENT properties (item*)>
<!ATTLIST properties
  profile CDATA #IMPLIED
>

<!ELEMENT item (#PCDATA | value | entry | bean)*>
<!ATTLIST item
  type      (single | array | list | map | set | properties) #IMPLIED
  name      CDATA #IMPLIED
  value     CDATA #IMPLIED
  valueType (string | int | long | float | double | boolean | parameters | file | multipart-file | bean) #IMPLIED
  tokenize  (true | false) #IMPLIED
  mandatory (true | false) #IMPLIED
  secret    (true | false) #IMPLIED
>

<!ELEMENT parameter (#PCDATA | value | entry | bean)*>
<!ATTLIST parameter
  type      (single | array | list | map | set | properties) #IMPLIED
  name      CDATA #IMPLIED
  value     CDATA #IMPLIED
  valueType (string | int | long | float | double | boolean | parameters | file | multipart-file | bean) #IMPLIED
  tokenize  (true | false) #IMPLIED
  mandatory (true | false) #IMPLIED
  secret    (true | false) #IMPLIED
>

<!ELEMENT attribute (#PCDATA | value | entry | bean)*>
<!ATTLIST attribute
  type      (single | array | list | map | set | properties) #IMPLIED
  name      CDATA #IMPLIED
  value     CDATA #IMPLIED
  valueType (string | int | long | float | double | boolean | parameters | file | multipart-file | bean) #IMPLIED
  tokenize  (true | false) #IMPLIED
  mandatory (true | false) #IMPLIED
  secret    (true | false) #IMPLIED
>

<!ELEMENT argument (#PCDATA | value | entry | bean)*>
<!ATTLIST argument
  type      (single | array | list | map | set | properties) #IMPLIED
  name      CDATA #IMPLIED
  value     CDATA #IMPLIED
  valueType (string | int | long | float | double | boolean | parameters | file | multipart-file | bean) #IMPLIED
  tokenize  (true | false) #IMPLIED
>

<!ELEMENT property (#PCDATA | value | entry | bean)*>
<!ATTLIST property
  type      (single | array | list | map | set | properties) #IMPLIED
  name      CDATA #IMPLIED
  value     CDATA #IMPLIED
  valueType (string | int | long | float | double | boolean | parameters | file | multipart-file | bean) #IMPLIED
  tokenize  (true | false) #IMPLIED
>

<!ELEMENT value (#PCDATA)>

<!ELEMENT entry (#PCDATA | bean)*>
<!ATTLIST entry
  name     CDATA #IMPLIED
  value    CDATA #IMPLIED
  tokenize (true | false) #IMPLIED
>

<!ELEMENT template (#PCDATA)>
<!ATTLIST template
  id          CDATA #IMPLIED
  engine      CDATA #IMPLIED
  name        CDATA #IMPLIED
  file        CDATA #IMPLIED
  resource    CDATA #IMPLIED
  url         CDATA #IMPLIED
  style       (apon | compact | compressed) #IMPLIED
  contentType CDATA #IMPLIED
  encoding    CDATA #IMPLIED
  noCache     (true | false) #IMPLIED
>

<!ELEMENT append (
  description*,
  settings?,
  (typeAliases | environment | aspect | bean | schedule | translet | template)*
)>
<!ATTLIST append
  file     CDATA #IMPLIED
  resource CDATA #IMPLIED
  url      CDATA #IMPLIED
  format   (xml | apon) #IMPLIED
  profile  CDATA #IMPLIED
>
