<?xml version="1.0" encoding="UTF-8"?>
<!DOCTYPE aspectran PUBLIC "-//ASPECTRAN//DTD Aspectran 9.0//EN"
        "https://aspectran.com/dtd/aspectran-9.dtd">
<aspectran>

    <description>
        You can run translets with a command line interpreter implemented using the jQuery Terminal Emulator.
    </description>

    <settings>
        <setting name="transletNamePrefix" value="/interpreter"/>
    </settings>

    <translet name="/">
        <echo id="page">
            <item name="headline">Remote Command Shell</item>
            <item name="teaser">You can run translets with a command line interpreter implemented using the jQuery Terminal Emulator.</item>
            <item name="include">terminal/translet-interpreter</item>
            <item name="style">plate console</item>
        </echo>
        <dispatch name="templates/default"/>
    </translet>

</aspectran>
