<?xml version="1.0" encoding="UTF-8"?>
<!DOCTYPE aspectran PUBLIC "-//ASPECTRAN//DTD Aspectran 9.0//EN"
        "https://aspectran.com/dtd/aspectran-9.dtd">
<aspectran>

    <description>
        Aspectran configuration for setting up an Undertow server.
    </description>

    <environment>
        <property name="tow.server.startup" valueType="boolean">false</property>
        <property name="tow.server.listener.http.port" valueType="int">%{system:tow.server.listener.http.port:8098}</property>
        <property name="tow.server.listener.http.host">0.0.0.0</property>
    </environment>

    <bean id="tow.server" class="com.aspectran.undertow.server.DefaultTowServer">
        <property name="autoStart">%{tow.server.startup}</property>
        <property name="httpListeners" type="array">
            <bean class="com.aspectran.undertow.server.HttpListenerConfig">
                <property name="port" valueType="int">%{tow.server.listener.http.port}</property>
                <property name="host">%{tow.server.listener.http.host}</property>
            </bean>
        </property>
        <property name="serverOptions">
            <bean class="com.aspectran.undertow.server.TowOptions">
                <property name="decodeUrl" valueType="boolean">true</property>
                <property name="urlCharset">UTF-8</property>
            </bean>
        </property>
        <property name="workerOptions">
            <bean class="com.aspectran.undertow.server.TowOptions">
                <property name="workerName">TOW</property>
            </bean>
        </property>
        <property name="requestHandlerFactory">
            <bean class="com.aspectran.undertow.server.handler.ServletRequestHandlerFactory">
                <property name="servletContexts" type="array">
                    <value>#{tow.context.root.servletContext}</value>
                </property>
                <property name="handlerChainWrappers" type="array">
                    <value>#{tow.server.handler.encodingHandlerWrapper}</value>
                    <value>#{tow.server.handler.accessLogHandlerWrapper}</value>
                </property>
            </bean>
        </property>
    </bean>

    <bean id="tow.server.handler.encodingHandlerWrapper"
          class="com.aspectran.undertow.server.handler.encoding.EncodingHandlerWrapper"
          scope="prototype">
        <property name="encodingProviders" type="array">
            <value>gzip</value>
        </property>
        <property name="encodingPredicates" type="array">
            <bean class="com.aspectran.undertow.server.handler.encoding.ContentEncodingPredicates">
                <property name="mediaTypes" type="array">
                    <value>text/html</value>
                    <value>text/css</value>
                    <value>text/javascript</value>
                    <value>application/javascript</value>
                </property>
            </bean>
            <bean class="com.aspectran.undertow.server.handler.encoding.ContentEncodingPredicates">
                <property name="contentSizeLargerThan" valueType="long">32</property>
                <property name="mediaTypes" type="array">
                    <value>text/xml</value>
                    <value>text/plain</value>
                    <value>application/json</value>
                    <value>application/xml</value>
                    <value>application/apon</value>
                </property>
            </bean>
        </property>
    </bean>

    <bean id="tow.server.handler.accessLogHandlerWrapper"
          class="com.aspectran.undertow.server.handler.accesslog.AccessLogHandlerWrapper"
          scope="prototype">
        <property name="formatString" tokenize="false">%t %a %{i,X-Forwarded-For} %{c,JSESSIONID} "%r" %s %b "%{i,Referer}" "%{i,User-Agent}"</property>
        <property name="category">io.undertow.accesslog</property>
    </bean>

</aspectran>
