<?xml version="1.0" encoding="UTF-8"?>
<!DOCTYPE aspectran PUBLIC "-//ASPECTRAN//DTD Aspectran 9.0//EN"
        "https://aspectran.com/dtd/aspectran-9.dtd">
<aspectran>

    <translet name="/">
        <echo id="page">
            <item name="headline">Welcome to Aspectran Demo Site</item>
            <item name="subheadline">Recommended best practices developed with Aspectran</item>
            <item name="teaser">This is a site to demonstrate examples developed using Aspectran.</item>
            <item name="include">home/main</item>
            <item name="style">plate solid</item>
        </echo>
        <dispatch name="templates/default"/>
    </translet>

</aspectran>
