<?xml version="1.0" encoding="UTF-8"?>
<!DOCTYPE aspectran PUBLIC "-//ASPECTRAN//DTD Aspectran 9.0//EN"
        "https://aspectran.com/dtd/aspectran-9.dtd">
<aspectran>

    <description>
        This is an Aspectran configuration for testing bean calls.
    </description>

    <bean id="firstBean" class="com.aspectran.core.sample.call.FirstBean"/>
    <bean id="secondBean" class="com.aspectran.core.sample.call.SecondBean"/>
    <bean id="thirdBean" class="com.aspectran.core.sample.call.ThirdBean"/>

    <bean id="totalBean" class="com.aspectran.core.sample.call.TotalBean">
        <property name="orderedBeans1" type="array">
            <value>#{firstBean}</value>
            <value>#{secondBean}</value>
            <value>#{thirdBean}</value>
        </property>
        <property name="orderedBeans2" type="array">
            <value>#{firstBean}</value>
            <value>#{secondBean}</value>
            <value>#{thirdBean}</value>
        </property>
    </bean>

</aspectran>
