<?xml version="1.0" encoding="UTF-8"?>
<!DOCTYPE aspectran PUBLIC "-//ASPECTRAN//DTD Aspectran 9.0//EN"
        "https://aspectran.com/dtd/aspectran-9.dtd">
<aspectran>

    <description>
        This is an Aspectran Configuration for Testing.
    </description>

    <settings>
        <setting name="defaultTemplateEngineBean" value="pebble"/>
    </settings>

    <bean id="pebble" class="com.aspectran.pebble.PebbleTemplateEngine">
        <argument>
            <bean class="com.aspectran.pebble.PebbleEngineFactoryBean">
                <property name="templateLoaderPath" type="array">
                    <value>classpath:view</value>
                </property>
                <property name="newLineTrimming" valueType="boolean">false</property>
<!--            <property name="disallowedTokenParserTags" type="set">-->
<!--                <value>include</value>-->
<!--            </property>-->
            </bean>
        </argument>
    </bean>

    <bean id="pebbleViewDispatcher" class="com.aspectran.pebble.view.PebbleViewDispatcher">
        <description>
            Register a Pebble View Dispatcher.
        </description>
        <argument>#{pebble}</argument>
        <property name="suffix">.peb</property>
    </bean>

    <translet name="echo-1">
        <request>
            <parameter name="input_1">${input_1:12345}</parameter>
            <parameter name="input_2">${input_2:67890}</parameter>
        </request>
        <transform format="text">
            <template engine="pebble" style="apon">
                |{{ input_1 }}{{ input_2 }}
            </template>
        </transform>
    </translet>

    <translet name="translet-1">
        <transform format="text">
            <template>~{template-1}</template>
        </transform>
    </translet>

    <translet name="translet-2">
        <dispatch name="template-2" dispatcher="pebbleViewDispatcher"/>
    </translet>

    <template id="template-1" engine="pebble" style="apon">
        |Name: {{ name }}, Email: {{ email }}
    </template>

    <translet name="template-include">
        <dispatch name="template-3" dispatcher="pebbleViewDispatcher"/>
    </translet>

</aspectran>
